[
  {
    "pontificate_id": "pontificate-001",
    "annuario_style_sequence": 1,
    "pope_id": "pope-001",
    "papal_name": "Peter",
    "pontificate_ordinal_for_person": 1,
    "pontificate_start": "",
    "pontificate_end": "",
    "date_precision": "not-yet-normalized",
    "is_current": false,
    "is_multiple_pontificate_case": false,
    "notes": ""
  },
  {
    "pontificate_id": "pontificate-002",
    "annuario_style_sequence": 2,
    "pope_id": "pope-002",
    "papal_name": "Linus",
    "pontificate_ordinal_for_person": 1,
    "pontificate_start": "",
    "pontificate_end": "",
    "date_precision": "not-yet-normalized",
    "is_current": false,
    "is_multiple_pontificate_case": false,
    "notes": ""
  },
  {
    "pontificate_id": "pontificate-003",
    "annuario_style_sequence": 3,
    "pope_id": "pope-003",
    "papal_name": "Anacletus",
    "pontificate_ordinal_for_person": 1,
    "pontificate_start": "",
    "pontificate_end": "",
    "date_precision": "not-yet-normalized",
    "is_current": false,
    "is_multiple_pontificate_case": false,
    "notes": ""
  },
  {
    "pontificate_id": "pontificate-004",
    "annuario_style_sequence": 4,
    "pope_id": "pope-004",
    "papal_name": "Clement I",
    "pontificate_ordinal_for_person": 1,
    "pontificate_start": "",
    "pontificate_end": "",
    "date_precision": "not-yet-normalized",
    "is_current": false,
    "is_multiple_pontificate_case": false,
    "notes": ""
  },
  {
    "pontificate_id": "pontificate-005",
    "annuario_style_sequence": 5,
    "pope_id": "pope-005",
    "papal_name": "Evaristus",
    "pontificate_ordinal_for_person": 1,
    "pontificate_start": "",
    "pontificate_end": "",
    "date_precision": "not-yet-normalized",
    "is_current": false,
    "is_multiple_pontificate_case": false,
    "notes": ""
  },
  {
    "pontificate_id": "pontificate-006",
    "annuario_style_sequence": 6,
    "pope_id": "pope-006",
    "papal_name": "Alexander I",
    "pontificate_ordinal_for_person": 1,
    "pontificate_start": "",
    "pontificate_end": "",
    "date_precision": "not-yet-normalized",
    "is_current": false,
    "is_multiple_pontificate_case": false,
    "notes": ""
  },
  {
    "pontificate_id": "pontificate-007",
    "annuario_style_sequence": 7,
    "pope_id": "pope-007",
    "papal_name": "Sixtus I",
    "pontificate_ordinal_for_person": 1,
    "pontificate_start": "",
    "pontificate_end": "",
    "date_precision": "not-yet-normalized",
    "is_current": false,
    "is_multiple_pontificate_case": false,
    "notes": ""
  },
  {
    "pontificate_id": "pontificate-008",
    "annuario_style_sequence": 8,
    "pope_id": "pope-008",
    "papal_name": "Telesphorus",
    "pontificate_ordinal_for_person": 1,
    "pontificate_start": "",
    "pontificate_end": "",
    "date_precision": "not-yet-normalized",
    "is_current": false,
    "is_multiple_pontificate_case": false,
    "notes": ""
  },
  {
    "pontificate_id": "pontificate-009",
    "annuario_style_sequence": 9,
    "pope_id": "pope-009",
    "papal_name": "Hyginus",
    "pontificate_ordinal_for_person": 1,
    "pontificate_start": "",
    "pontificate_end": "",
    "date_precision": "not-yet-normalized",
    "is_current": false,
    "is_multiple_pontificate_case": false,
    "notes": ""
  },
  {
    "pontificate_id": "pontificate-010",
    "annuario_style_sequence": 10,
    "pope_id": "pope-010",
    "papal_name": "Pius I",
    "pontificate_ordinal_for_person": 1,
    "pontificate_start": "",
    "pontificate_end": "",
    "date_precision": "not-yet-normalized",
    "is_current": false,
    "is_multiple_pontificate_case": false,
    "notes": ""
  },
  {
    "pontificate_id": "pontificate-011",
    "annuario_style_sequence": 11,
    "pope_id": "pope-011",
    "papal_name": "Anicetus",
    "pontificate_ordinal_for_person": 1,
    "pontificate_start": "",
    "pontificate_end": "",
    "date_precision": "not-yet-normalized",
    "is_current": false,
    "is_multiple_pontificate_case": false,
    "notes": ""
  },
  {
    "pontificate_id": "pontificate-012",
    "annuario_style_sequence": 12,
    "pope_id": "pope-012",
    "papal_name": "Soter",
    "pontificate_ordinal_for_person": 1,
    "pontificate_start": "",
    "pontificate_end": "",
    "date_precision": "not-yet-normalized",
    "is_current": false,
    "is_multiple_pontificate_case": false,
    "notes": ""
  },
  {
    "pontificate_id": "pontificate-013",
    "annuario_style_sequence": 13,
    "pope_id": "pope-013",
    "papal_name": "Eleutherius",
    "pontificate_ordinal_for_person": 1,
    "pontificate_start": "",
    "pontificate_end": "",
    "date_precision": "not-yet-normalized",
    "is_current": false,
    "is_multiple_pontificate_case": false,
    "notes": ""
  },
  {
    "pontificate_id": "pontificate-014",
    "annuario_style_sequence": 14,
    "pope_id": "pope-014",
    "papal_name": "Victor I",
    "pontificate_ordinal_for_person": 1,
    "pontificate_start": "",
    "pontificate_end": "",
    "date_precision": "not-yet-normalized",
    "is_current": false,
    "is_multiple_pontificate_case": false,
    "notes": ""
  },
  {
    "pontificate_id": "pontificate-015",
    "annuario_style_sequence": 15,
    "pope_id": "pope-015",
    "papal_name": "Zephyrinus",
    "pontificate_ordinal_for_person": 1,
    "pontificate_start": "",
    "pontificate_end": "",
    "date_precision": "not-yet-normalized",
    "is_current": false,
    "is_multiple_pontificate_case": false,
    "notes": ""
  },
  {
    "pontificate_id": "pontificate-016",
    "annuario_style_sequence": 16,
    "pope_id": "pope-016",
    "papal_name": "Callixtus I",
    "pontificate_ordinal_for_person": 1,
    "pontificate_start": "",
    "pontificate_end": "",
    "date_precision": "not-yet-normalized",
    "is_current": false,
    "is_multiple_pontificate_case": false,
    "notes": ""
  },
  {
    "pontificate_id": "pontificate-017",
    "annuario_style_sequence": 17,
    "pope_id": "pope-017",
    "papal_name": "Urban I",
    "pontificate_ordinal_for_person": 1,
    "pontificate_start": "",
    "pontificate_end": "",
    "date_precision": "not-yet-normalized",
    "is_current": false,
    "is_multiple_pontificate_case": false,
    "notes": ""
  },
  {
    "pontificate_id": "pontificate-018",
    "annuario_style_sequence": 18,
    "pope_id": "pope-018",
    "papal_name": "Pontian",
    "pontificate_ordinal_for_person": 1,
    "pontificate_start": "",
    "pontificate_end": "",
    "date_precision": "not-yet-normalized",
    "is_current": false,
    "is_multiple_pontificate_case": false,
    "notes": ""
  },
  {
    "pontificate_id": "pontificate-019",
    "annuario_style_sequence": 19,
    "pope_id": "pope-019",
    "papal_name": "Anterus",
    "pontificate_ordinal_for_person": 1,
    "pontificate_start": "",
    "pontificate_end": "",
    "date_precision": "not-yet-normalized",
    "is_current": false,
    "is_multiple_pontificate_case": false,
    "notes": ""
  },
  {
    "pontificate_id": "pontificate-020",
    "annuario_style_sequence": 20,
    "pope_id": "pope-020",
    "papal_name": "Fabian",
    "pontificate_ordinal_for_person": 1,
    "pontificate_start": "",
    "pontificate_end": "",
    "date_precision": "not-yet-normalized",
    "is_current": false,
    "is_multiple_pontificate_case": false,
    "notes": ""
  },
  {
    "pontificate_id": "pontificate-021",
    "annuario_style_sequence": 21,
    "pope_id": "pope-021",
    "papal_name": "Cornelius",
    "pontificate_ordinal_for_person": 1,
    "pontificate_start": "",
    "pontificate_end": "",
    "date_precision": "not-yet-normalized",
    "is_current": false,
    "is_multiple_pontificate_case": false,
    "notes": ""
  },
  {
    "pontificate_id": "pontificate-022",
    "annuario_style_sequence": 22,
    "pope_id": "pope-022",
    "papal_name": "Lucius I",
    "pontificate_ordinal_for_person": 1,
    "pontificate_start": "",
    "pontificate_end": "",
    "date_precision": "not-yet-normalized",
    "is_current": false,
    "is_multiple_pontificate_case": false,
    "notes": ""
  },
  {
    "pontificate_id": "pontificate-023",
    "annuario_style_sequence": 23,
    "pope_id": "pope-023",
    "papal_name": "Stephen I",
    "pontificate_ordinal_for_person": 1,
    "pontificate_start": "",
    "pontificate_end": "",
    "date_precision": "not-yet-normalized",
    "is_current": false,
    "is_multiple_pontificate_case": false,
    "notes": ""
  },
  {
    "pontificate_id": "pontificate-024",
    "annuario_style_sequence": 24,
    "pope_id": "pope-024",
    "papal_name": "Sixtus II",
    "pontificate_ordinal_for_person": 1,
    "pontificate_start": "",
    "pontificate_end": "",
    "date_precision": "not-yet-normalized",
    "is_current": false,
    "is_multiple_pontificate_case": false,
    "notes": ""
  },
  {
    "pontificate_id": "pontificate-025",
    "annuario_style_sequence": 25,
    "pope_id": "pope-025",
    "papal_name": "Dionysius",
    "pontificate_ordinal_for_person": 1,
    "pontificate_start": "",
    "pontificate_end": "",
    "date_precision": "not-yet-normalized",
    "is_current": false,
    "is_multiple_pontificate_case": false,
    "notes": ""
  },
  {
    "pontificate_id": "pontificate-026",
    "annuario_style_sequence": 26,
    "pope_id": "pope-026",
    "papal_name": "Felix I",
    "pontificate_ordinal_for_person": 1,
    "pontificate_start": "",
    "pontificate_end": "",
    "date_precision": "not-yet-normalized",
    "is_current": false,
    "is_multiple_pontificate_case": false,
    "notes": ""
  },
  {
    "pontificate_id": "pontificate-027",
    "annuario_style_sequence": 27,
    "pope_id": "pope-027",
    "papal_name": "Eutychian",
    "pontificate_ordinal_for_person": 1,
    "pontificate_start": "",
    "pontificate_end": "",
    "date_precision": "not-yet-normalized",
    "is_current": false,
    "is_multiple_pontificate_case": false,
    "notes": ""
  },
  {
    "pontificate_id": "pontificate-028",
    "annuario_style_sequence": 28,